{
  "schema": "sister.component/1.0.0",
  "component_id": "example",
  "system_id": "sister_example",
  "deployment_role": "system",
  "semantic_contract": "sister.subsystem/1.0.0",
  "build": {
    "driver": "cmake-ninja/1",
    "source": ".",
    "build_dir": "build",
    "configuration": "Release",
    "tests": {
      "driver": "ctest/1"
    },
    "artifacts": [
      {
        "id": "http-server",
        "path": "build/sister-example-http",
        "executable": true
      }
    ]
  },
  "runtime": {
    "schema": "sister.runtime/1.0.0",
    "entrypoint": "scripts/runtime.sh",
    "actions": [
      "start",
      "stop",
      "restart",
      "status",
      "health",
      "readiness"
    ],
    "state_policy": "persistent-external"
  }
}
